{
  "applications": [
    {
      "action_queue": [],
      "activation": {
        "active_at_export": false,
        "cycle_end": "2028-05-01",
        "effective_date": "2026-05-01",
        "privileges": [
          "PRIV-FM"
        ]
      },
      "application_id": "APP-2026-001",
      "approval_decision_id": "GBD-2026-011",
      "decisions": [
        {
          "admitted": true,
          "decision_id": "MEC-2026-011",
          "reason": null
        },
        {
          "admitted": true,
          "decision_id": "GBD-2026-011",
          "reason": null
        }
      ],
      "elements": {
        "certification": "resolved",
        "education": "resolved",
        "experience": "resolved",
        "gaps": "resolved",
        "licensure": "resolved",
        "references": "resolved"
      },
      "monitored_conditions": [],
      "packet_presentable": false,
      "revision": 1,
      "status": "approved-not-yet-effective"
    },
    {
      "action_queue": [],
      "activation": null,
      "application_id": "APP-2026-002",
      "approval_decision_id": null,
      "decisions": [
        {
          "admitted": true,
          "decision_id": "MEC-2026-012",
          "reason": null
        }
      ],
      "elements": {
        "certification": "resolved",
        "education": "resolved",
        "experience": "resolved",
        "gaps": "resolved",
        "licensure": "resolved",
        "references": "resolved"
      },
      "monitored_conditions": [],
      "packet_presentable": true,
      "revision": 1,
      "status": "packet-presentable"
    },
    {
      "action_queue": [],
      "activation": {
        "active_at_export": true,
        "cycle_end": "2028-04-14",
        "effective_date": "2026-04-14",
        "privileges": [
          "PRIV-EM"
        ]
      },
      "application_id": "APP-2026-003",
      "approval_decision_id": "GBD-2026-013",
      "decisions": [
        {
          "admitted": true,
          "decision_id": "MEC-2026-013",
          "reason": null
        },
        {
          "admitted": true,
          "decision_id": "GBD-2026-013",
          "reason": null
        }
      ],
      "elements": {
        "certification": "resolved",
        "education": "resolved",
        "experience": "resolved",
        "gaps": "resolved",
        "licensure": "resolved",
        "references": "resolved"
      },
      "monitored_conditions": [],
      "packet_presentable": false,
      "revision": 1,
      "status": "active"
    },
    {
      "action_queue": [],
      "activation": null,
      "application_id": "APP-2026-004",
      "approval_decision_id": null,
      "decisions": [
        {
          "admitted": true,
          "decision_id": "MEC-2026-014",
          "reason": null
        }
      ],
      "elements": {
        "certification": "resolved",
        "education": "resolved",
        "experience": "resolved",
        "gaps": "resolved",
        "licensure": "resolved",
        "references": "resolved"
      },
      "monitored_conditions": [],
      "packet_presentable": true,
      "revision": 1,
      "status": "packet-presentable"
    },
    {
      "action_queue": [
        {
          "due": null,
          "item": "Clinical Director: is the explanation for the gap 2013-07-01 to 2013-07-30 satisfactory?",
          "owner": "Clinical Director"
        }
      ],
      "activation": null,
      "application_id": "APP-2026-005",
      "approval_decision_id": null,
      "decisions": [
        {
          "admitted": true,
          "decision_id": "MEC-2026-015",
          "reason": null
        }
      ],
      "elements": {
        "certification": "resolved",
        "education": "resolved",
        "experience": "resolved",
        "gaps": "finding",
        "licensure": "resolved",
        "references": "resolved"
      },
      "monitored_conditions": [],
      "packet_presentable": false,
      "revision": 1,
      "status": "in-verification"
    },
    {
      "action_queue": [],
      "activation": null,
      "application_id": "APP-2026-006",
      "approval_decision_id": null,
      "decisions": [
        {
          "admitted": true,
          "decision_id": "MEC-2026-016",
          "reason": null
        }
      ],
      "elements": {
        "certification": "resolved",
        "education": "resolved",
        "experience": "resolved",
        "gaps": "resolved",
        "licensure": "resolved",
        "references": "resolved"
      },
      "monitored_conditions": [],
      "packet_presentable": true,
      "revision": 1,
      "status": "packet-presentable"
    },
    {
      "action_queue": [],
      "activation": {
        "active_at_export": false,
        "cycle_end": "2028-04-27",
        "effective_date": "2026-04-27",
        "privileges": [
          "PRIV-PSY"
        ]
      },
      "application_id": "APP-2026-007",
      "approval_decision_id": "GBD-2026-017",
      "decisions": [
        {
          "admitted": true,
          "decision_id": "MEC-2026-017",
          "reason": null
        },
        {
          "admitted": true,
          "decision_id": "GBD-2026-017",
          "reason": null
        }
      ],
      "elements": {
        "certification": "resolved",
        "education": "resolved",
        "experience": "resolved",
        "gaps": "resolved",
        "licensure": "resolved",
        "references": "resolved"
      },
      "monitored_conditions": [],
      "packet_presentable": false,
      "revision": 1,
      "status": "approved-not-yet-effective"
    },
    {
      "action_queue": [],
      "activation": null,
      "application_id": "APP-2026-008",
      "approval_decision_id": null,
      "decisions": [
        {
          "admitted": true,
          "decision_id": "MEC-2026-018",
          "reason": null
        }
      ],
      "elements": {
        "certification": "resolved",
        "education": "resolved",
        "experience": "resolved",
        "gaps": "resolved",
        "licensure": "resolved",
        "references": "resolved"
      },
      "monitored_conditions": [],
      "packet_presentable": true,
      "revision": 1,
      "status": "packet-presentable"
    },
    {
      "action_queue": [],
      "activation": null,
      "application_id": "APP-2026-009",
      "approval_decision_id": null,
      "decisions": [
        {
          "admitted": true,
          "decision_id": "MEC-2026-019",
          "reason": null
        }
      ],
      "elements": {
        "certification": "resolved",
        "education": "resolved",
        "experience": "resolved",
        "gaps": "resolved",
        "licensure": "resolved",
        "references": "resolved"
      },
      "monitored_conditions": [],
      "packet_presentable": true,
      "revision": 1,
      "status": "packet-presentable"
    },
    {
      "action_queue": [
        {
          "due": null,
          "item": "Certification for American Board of Pediatrics shows status 'Not certified'; route to Clinical Director",
          "owner": "Clinical Director"
        }
      ],
      "activation": null,
      "application_id": "APP-2026-010",
      "approval_decision_id": null,
      "decisions": [
        {
          "admitted": true,
          "decision_id": "MEC-2026-020",
          "reason": null
        }
      ],
      "elements": {
        "certification": "finding",
        "education": "resolved",
        "experience": "resolved",
        "gaps": "resolved",
        "licensure": "resolved",
        "references": "resolved"
      },
      "monitored_conditions": [],
      "packet_presentable": false,
      "revision": 1,
      "status": "in-verification"
    },
    {
      "action_queue": [],
      "activation": null,
      "application_id": "APP-2026-011",
      "approval_decision_id": null,
      "decisions": [
        {
          "admitted": true,
          "decision_id": "MEC-2026-021",
          "reason": null
        }
      ],
      "elements": {
        "certification": "resolved",
        "education": "resolved",
        "experience": "resolved",
        "gaps": "resolved",
        "licensure": "resolved",
        "references": "resolved"
      },
      "monitored_conditions": [],
      "packet_presentable": true,
      "revision": 1,
      "status": "packet-presentable"
    },
    {
      "action_queue": [],
      "activation": null,
      "application_id": "APP-2026-012",
      "approval_decision_id": null,
      "decisions": [
        {
          "admitted": true,
          "decision_id": "MEC-2026-022",
          "reason": null
        }
      ],
      "elements": {
        "certification": "resolved",
        "education": "resolved",
        "experience": "resolved",
        "gaps": "resolved",
        "licensure": "resolved",
        "references": "resolved"
      },
      "monitored_conditions": [],
      "packet_presentable": true,
      "revision": 1,
      "status": "packet-presentable"
    },
    {
      "action_queue": [],
      "activation": {
        "active_at_export": false,
        "cycle_end": "2028-05-01",
        "effective_date": "2026-05-01",
        "privileges": [
          "PRIV-IM"
        ]
      },
      "application_id": "APP-2026-013",
      "approval_decision_id": "GBD-2026-023",
      "decisions": [
        {
          "admitted": true,
          "decision_id": "MEC-2026-023",
          "reason": null
        },
        {
          "admitted": true,
          "decision_id": "GBD-2026-023",
          "reason": null
        }
      ],
      "elements": {
        "certification": "resolved",
        "education": "resolved",
        "experience": "resolved",
        "gaps": "resolved",
        "licensure": "resolved",
        "references": "resolved"
      },
      "monitored_conditions": [],
      "packet_presentable": false,
      "revision": 1,
      "status": "approved-not-yet-effective"
    },
    {
      "action_queue": [
        {
          "due": null,